" And I see you have your your housemaid in attendance? " # " Cook, actually, " I said. # Berta drew up all five feet one inch of herself in magisterial silence. # " My family could not arrive in time for the funeral, " I said. # " What a pity. " # Not really. " Yes, " I said. " They set off from Rome just as soon as they heard the news. I believe they'll	arrive	home sometime tomorrow. " Mother, Father, and my sister, Lillian, were at present hurtling across the Atlantic aboard a Cunard ocean liner, returning from a three-month-long European shopping excursion. " And my brother, Andrew, is in the thick of studying for his final exams at Yale, so I told him to stay absolutely chained to his desk, or Father would be cross. "	believe	homebase	homebase		natural	COCA; 2015; New York, N.Y. : Minotaur Books,Edition: First edition; Come hell or highball :a mystery; Chance, Maia; FIC: Come hell or highball :a mystery 
I arrived at the INPO office for an 11:00 AM press conference. Two TV stations, 1 or 2 radio stations and several print journalists were there. I knew many of them so we did that right cheek, left cheek, right cheek kiss thing around the room for several minutes. Then we ordered macchiato. We stood/sat around waiting for that to	arrive	-- no need to get in any hurry you know.	none	3rd	none		natural	CORE; Personal Blog; Way Down In Kosovo; http://waydowninkosovo1.blogspot.com/
" They say that Sahalie Falls is 100 feet tall. The pure drop after the first dip is about 80 feet. It's an impressive sight by itself, never mind seeing somebody kayak off it, " says photographer Tim Kemple. A recent snowstorm left the landscape highlighting vibrant blue and green hues. " The water was bright blue, the moss was electric green, and the snow juxtaposes everything perfectly, " says Kemple. The group waited for clouds to	arrive	, ensuring Kemple was photographing in even light.	none	3rd	none		natural	CORE; Personal Blog; Extreme Photo of the Week -- National Geographic; http://adventure.nationalgeographic.com/adventure/extreme-photo-of-the-week/ 
Washington wrote to Alexander Hamilton on the 22nd, " The distressed situation of the army, for want of blankets and many necessary articles of clothing, is truly deplorable, and inevitably must bring destruction to it, unless a speedy remedy is applied. " Local leaders did what they could to supply the army with food and clothing. Reinforcements sent by Congress began to	arrive	, and Washington felt the army was sufficiently ready to mount an attack.	none	3rd	none		natural	CORE; Historical Article; History of the Battle of the Brandywine; http://www.ushistory.org/brandywine/thestory.htm 
So why should you buy an eBook reader? Convenience. Instead of going to a bookstore to make a purchase or ordering a book online and waiting for it to	arrive	, you can purchase and download an eBook anytime, from any location with a Wi-Fi connection.	none	3rd	none		natural	CORE; Review; eBook Reader 2013 | Compare Best eReaders | eBook Reader; http://ebook-reader-review.toptenreviews.com/ 
Packages addressed to Nicholas Danner c/o Toyco. # Why they weren't sent to his home, Danner couldn't say. He didn't even know where they came from. No notes included. No return address. # The contents of these tiny parcels were oddly shaped bits of plastic and metal, like pieces left over from an assemble-it-yourself kit, or the sweepings of a junk shop. # It could have been a joke, or the activity of a schizophrenic, he thought, until the third package	arrived	with a note.	none	3rd	none		natural	COCA; 2017; Hoboken Vol. 132, Iss. 3/4,  (Mar/Apr 2017): 84-176.; The Man Who Put the Bomp; Chwedyk, Richard; FIC: Fantasy & Science Fiction 
To celebrate our friend's birthday, my family invited a few people over for lunch, including a local pastor, his wife, and their young children. I tidied up the house and inspected every corner (or so I thought) before everyone	arrived	. After our guests left, I went into the bathroom and closed the door -- and was mortified to see my bra hanging behind the door!	none	3rd	none		natural	COCA; 2008 (Dec 2008); Vol. 211, Iss. 6; pg. 80; RED IN THE FACE; MAG: Redbook 
Chunyu Bai stood at the bus stop, waiting for a tunnel bus. # " The Cross Harbour Tunnel is a wonderful piece of engineering linking Kowloon and Hong Kong island. In the past, if you wanted to go to the Hong Kong side from Kowloon or vice versa, you had to waste a lot of time, first on the bus and then the ferry. But now, a tunnel bus from Mongkok to Causeway Bay takes less than fifteen minutes, " he thought. # The bus	arrived	. # He got on. # He dropped a coin into the fare box, climbed to the upper deck, and chose a window seat.	none	3rd	none		natural	COCA; 2004 (Summer); Vol. 47, Iss. 4; pg. 10, 33 pgs; Intersection; Liu Yichang; FIC: Literary Review 
We'll go to the market in Beaumont. I've read it's wonderful and they sell live animals. " # " I've always wanted a goat. " # They laugh, clicking glasses, proud that they made it this far. That they have reached this place. They have opened the shutters and made food from the garden. Sonia is savoring the dry red wine Katrine and Michel left them when she hears the mewing. On the windowsill just outside she sees the cat. She hasn't even thought about the cat since they	arrived	, but now he is on the ledge, begging to be let in. # Pet care was part of their exchange. She hadn't minded.	none	3rd	none	FID	natural	COCA; 2003 (Winter); Vol. 132, Iss. 1; pg. 106, 15 pgs; Exchanges; Mary Morris; FIC: Daedalus 
He recalled how intensely the man had worked during the recent space mission. Spivey was driven, all right. Sometimes that could be a good thing. It could also make some people dangerous. " You're sure these people will keep their word? " she whispered to Manella. He looked back with amusement. " Of course I'm not sure! Lustig may be nonviolent, but what do we know about his backers? " Again, he shrugged. " We'll find out soon enough. " Ask a foolish question.. Teresa thought. Their tour guide	arrived	at last, a dark-haired, dark-skinned young man with broad shoulders and a pleasant smile.	none	3rd	none		natural	COCA; 1990; Bantam Books, New York; Earth; David Brin; FIC: Earth 
Rothberg applied regular admission to Harvard. The Harvard interview was at the suburban mansion of a prominent St. Louis lawyer, known to their family. Rothberg followed the lawyer from one room to another in his meandering rec-room basement playing pinball and choosing songs from his 1950s era jukeboxes. The assumption seemed to be not only that he would get into Harvard but that he would go. # " What are you going to do, stay at home and look at me? " His mother said when the admission letter	arrived	. " I'm going to work every day. " She shrugged her shoulders characteristically. " I'm not sure I even like the idea of you waiting around for me to die. " But Rothberg didn't believe her. This was his father's issue. For once, his father didn't say a word.	none	3rd	none		natural	COCA; 2019 (2018/09/22); Issue 100; Rothberg's Fathe
Henry followed Richard and McCampbell outside. Snow had fallen the previous night. Only patches remained, but the cold crept through Henry's boots, resoled many times since he was a quartermaster for Jubal Early. The swan was the biggest and finest he had ever seen, and it had the river all to itself. # Nelle	arrived	with baby John and his nurse, Pearl. Nelle was due to give birth again in the spring, and her shape showed through her winter coat. # " You shouldn't have walked, " said Richard, sounding anxious. # " A five-minute stroll, " Nelle said. " It's bad enough I can't ride. "	none	accompaniment	with baby John and his nurse		natural	COCA; 2019 (2018/01/01); Vol. 54, Issue 1; Carbon Tet: Rapidan, Virginia, December 1910
If memory serves, in one of his last chapters he wrote about female penguins and this strange, innate sense they seem to have. Even though they are hundreds of miles away from their eggs, they somehow know exactly when their chicks will hatch and are able to	arrive	home within hours of the big event.	none	homebase	home		natural	CORE; Personal Blog; Cynicism & Hypocrisy :: 2 Sides of the Same Coin; http://joelnclark.com/2012/09/2-sides/ 
You're back at your desk at HackFix by 2:00 p.m. The rest of your afternoon is spent catching up on the trajectories of HackFix projects during your vacation. A costly five-year effort finally succeeded in cracking security at the Yunnan-Hanoi Auspicious Electron particle accelerator, and a root kit has installed itself in the unit's software controller. # It's dark by the time you	arrive	home at your apartment. You phone out for Chinese and when it arrives, you eat it standing up, out of the carton, gazing through the window at the lights of Central Park far below. The lake has frozen over but you can't spot any skaters. The Park Conservancy probably thinks the ice is still too thin.	none	homebase	home		natural	COCA; 2017; Hoboken Vol. 132, Iss. 5/6,  (May/Jun 2017): 208-228; The First Day of Someone Else's Life; Schoffstall, John; FIC: Fantasy & Science Fiction
Is there assigned seating on the bus? # There is no assigned seating on the bus - it's first come, first serve. If you have a number of people in your party that want to sit together, you should make sure to	arrive	15-20 minutes early.	none	listener	none		natural	CORE;   Informational Description; Sex and the City Hotspots - Zerve; http://www.zerve.com/OnLocation/SATC 
Corkscrew Swamp, where a boardwalk takes us through a fascinating and beautiful natural world of giant cypresses and Virginia creeper, will produce stunning nature images by the dozens, and overall is a very exciting place. # On Day Six, return to Palm Beach Gardens via Lake Okeechobee and the rural heart of South Florida. In the early afternoon, you will	arrive	back at the hotel where tour services will end.	none	listener	back at the hotel		natural	COCA; 1996 (Jan); Jan96, Vol. 62 Issue 1, p24, 4p, 1bw; Photographer's paradise.; Goldberg, Gerald S.; ACAD: PSA Journal 
Catch the BC Ferry ($82.25 for two) from Victoria for the hour-and-a-half journey to Vancouver. When you	arrive	, seek out the Granville Island Farmers Market to browse local shops like coffee roaster JJ Bean and the Granville Island Tea Co. Take Edible Canada's Shop and Sample Tour ($40) to meet farmers and artisans, do some tasting, and snag discounts. Next, head toward the harbor to explore historic Gastown, which is packed with boutiques, cocktail bars, and art galleries.	none	listener	none		natural	COCA; 2013; Aug2013, Vol. 42 Issue 7, p94. 1p; THE PACIFIC Northwest; KELSO, STIRLING; MILLER, JENNIFER; MAG: Money 
One day she went by the placement office and was told she had missed a NASA recruiter the day before. Darden filled out an application and was later offered the job in its computing pool. The notice arrived about the time she received offers from the Norfolk Division of Virginia State College (now Norfolk State University) and Hampton Institute, but NASA offered more money and more adventure. Or so she thought. # She	arrived	in 1967 when NASA had seen some of its most historic achievements. Computer pools were now integrated.	none	protagonist	none		natural	COCA; 2017 (17-01-01); "Hidden Figures" no longer. New movie highlights the achievements ...; NEWS: Virginian-Pilot 
Foggy became more of a nuisance than a partner. The more she gave Spurgell, the less there was for Foggy. At first, Foggy didn't mind; he knew that deep down she still cared. He could take the punches as long as Spurgell got the love. # Marge spent her days napping with Spurgell and keeping a snug home. She gave up smoking for the babe and upped the ante on sweets. Most of her clothes didn't fit anymore, so she took to wearing loose nighties. More often than not, Foggy would	arrive	home from work and find the two of them curled up on the couch in front of the TV, fast asleep, their faces smudged with whatever colour icing she'd used that day for baking.	none	protagonist	home		natural	COCA; 2019 (2018/03/22); Vol. 98, Issue 1; THE OICKELS
The cinema has fifteen seats -- soft moss-green armchairs -- and two cutting-edge sea-green projectors that whirr softly in the darkness behind a glass panel. # To get from Hammars to the cinema, you and your two half siblings squeeze into the back seat of the father's car at exactly 7:40 P.M., twenty minutes before the movie starts. It is a short drive, ten minutes at the most, but once you	arrive	you need an additional ten minutes to adjust. No rushing in and out. Same thing in the afternoon.	none	protagonist	none		natural	COCA; 2019; 12/17/2018, Vol. 94, Issue 41; Time for the Eyes to Adjust
At a nearby restaurant, we met other boat owners who'd also come into West Palm Beach from the Bahamas, had the same experience we did, and were guilty of jumping ship before clearing Customs. So much for Homeland Security, I thought. We'd	arrived	on a Sunday afternoon. The U.S. Customs phone number we'd called was listed in the cruising guides for use on weekends or after business hours.	none	speaker	none		natural	COCA; 2003 (Dec); Vol. 192, Iss. 3; pg. 47; Coming Home Sawdust's crewmembers feel a mixture of joy and sadness on returning to Annapolis after their 6,000-mile Great Circle Route voyage.; George Sass, Sr.; MAG: Motor Boating 
I had been blessed, three years earlier, to find a house and a housekeeper in one, when one of my aged college dons died and her lifelong companion fell on hard times. Miss Pidgeon understood the conflicting urges of comfort and privacy, and provided the first without threatening the second. She lived in what had once been the servants' quarters, separated by a small garden from the house proper, and with so much as a few hours' warning, I would	arrive	to find the icebox filled with milk and essentials, a fire laid (if not actually burning), newspapers beside the settee, and never more sign of an actual person than a brief note of welcome on the kitchen table. She never made the mistake of tidying my papers, and she had an unexpectedly good eye for who might be an intruder and who looked like one of the owner's odd friends.	none	speaker	none		natural	COCA; 2016; Dreaming spies : a novel of suspense featuring Mary Russell and Sherlock Holmes; Laurie R King; FIC: Dreaming spies : a novel of suspense featuring Mary Russell and Sherlock Holmes 
During the later stages of my father's battle with cancer, he spent many hours in bed recovering from chemotherapy treatments. I would	arrive	every Sunday morning, not knowing if our conversations would take place at the kitchen table or at his bedside. One particularly rough chemo session left my father so weak that he did not even wake up when I entered his bedroom.	none	speaker	every Sunday morning		natural	COCA; 2005 (Dec); Dec2005, Vol. 33 Issue 2, p68-70, 3p; reading lifelong literacy links into the school library; McPherson, Keith; ACAD: Teacher Librarian 
He had to take my temperature and show her I was as normal as anyone. " Well, I still think she can make herself hotter at will, " she muttered. Perhaps I could. Perhaps there were some hot embers burning inside me, something I could flame up whenever I wanted to and, like a dragon, breathe fire at her. I must say she worked hard at finding me a home, but it wasn't because she felt sorry for me. She simply wanted me out of her orphanage almost as soon as I had	arrived	. Sometimes I overheard her describing me to prospective foster parents, and I was amazed at the compliments she would give me. According to her I was the brightest, nicest, most responsible child there. She always managed to slip in the fact that I had an inheritance, acres of land, and a house kept in trust.	none	speaker	none		natural	COCA; 2005; New York :; Pocket Books, Edition: 1st Pocket Books hardcover ed; Child of darkness; Andrews, V. C. (Virginia C.);  FIC: Child of darkness 
In my copy at home, Danny's copy, there is more: On the title page, my stepfather has written: " To my longed-for son, with hopes that our paths will meet again, in this jungle or the next. " I'd gotten the book from Danny the week before, when he'd called and asked me to come and get rid of the things Melissa had left behind. " Dad's latest, I assume, " he'd said when I	arrived	, tossing me a wrapped package. " There are more books plus some sheets and things. I'm late for work. Take all of it, " he'd said, glaring frantically around the living room, which was a disaster. " Don't clean up. I'll do it later. " Then he fled, slamming the door.	none	speaker	none		natural	COCA; 2013; Mar2013, Vol. 135 Issue 3, p35-45. 11p; The Stanford Marshmallow Experiment; MOORE, FERNANDA; FIC: Commentary 
Anna Gardie's nearly half decade of fame came at the height of refugee stage success, and she demonstrated her talent for transforming the misfortunes of slave revolution into stage celebrity. Newspaper reports signal the beginning of her US stage career during Philadelphia's 1794 spring theater season, when she appeared at Thomas Wignell's New Theatre in La forêt noire, a French pantomime. Advertisements billed her as newly	arrived	" from the Theatre at Paris, " even though, by all accounts, she had most recently come from Saint Domingue (" New Theatre "). Whether by choice or not, Gardie almost always performed nonspeaking roles, usually as a dancer and pantomimist. She also occasionally sang French songs, and her greatest American success (judging by its frequency in her repertoire) seems to have been as Columbine, the nonspeaking female lead in the winter holiday season's harlequinades.	other; bill	protagonist	from the Theatre at Paris		natural	COCA;   2016; Chapel Hill Vol. 51, Iss. 3,  (2016): 623-652,755; The Life and Death of Anna Gardie: American Theater, Refugee Dramas, and the Specter of Haitian Revolution; Reed, Peter P; ACAD: Early American Literature 
The employer is not responsible for the cost of a worker's lodging when the worker chooses to	arrive	earlier than required for a visa appointment at the U.S. Consulate.	other; choose	attitude holder	none		natural	CORE; FAQ about Information; OFLC Frequently Asked Questions and Answers; http://www.foreignlaborcert.doleta.gov/faqsanswers.cfm 
Warm weather is beginning and winter is becoming a distant memory. While many of us use this time to do a little cleaning around the house, it's also a good idea to perform routine summer maintenance to our car-especially before hitting the road on that much-anticipated family vacation. So whether you're planning a cross-country trip, or treks back and forth to summer camp and baseball practice, having a well-maintained car can ensure that you	arrive	to and leave from your destination without incident. John B. Townsend II, director of public and government affairs for AAA Mid-Atlantic, says car care is essential heading into the hot season. " Most motorists fail to realize it, but extremely high heat actually exacts a higher toll on cars and engines than extremely cold weather does, " he says.	other; ensure	listener	to your destination		natural	COCA; 2008 (May 2008); Vol. 63, Iss. 7; pg. 126, 2 pgs; Are you really ready for that weekend road trip?; Kevin Chappell; MAG: Ebony 
The year before he left, my father took me to the racetrack. He sold life insurance during the week, and on weekends he went to the races. I was eleven years old, and sitting in the front seat of our rusty Ford station wagon. The speed limit was twenty-five, but my father was going fifty, running through stop signs, our tires screeching as he cut around bends. # He'd grown up on a ranch and knew about horses. He explained that if you	arrived	before starting time, you could go down to the track and examine the animals. Sometimes a horse had been worked too hard in practice, and you could notice it before the race began, see it in the creature's face, the moisture around his eyes. " It's like insurance, " my father said. " You try to guess the odds, then you decide. "	other; explain	embedded listener	before starting time		natural	COCA; 1992; Summer92, Vol. 33 Issue 2, p201, 16p; Spitting image; FIC: Massachusetts Review 
The best you can do to prepare your child for college is what you have been doing... love, support, encourage. Show them you care and that you are excited for them. Let them know you believe they will be successful goes a long way. # Do not feel like you have to be the first to	arrive	on moving day. Getting there early or later will still result in the same room, set-up, etc.	other; feel like	listener	none		natural	CORE; Personal Blog; It's Good To Be The Dad; http://www.itsgoodtobethedad.com/ 
"Tthe fellow with whom I'd intended to do a bit of business met with an accident. I'm rather frazzled, I'm afraid. " It wasn't entirely the truth, but it was as much as she was willing to divulge to anyone. The fact that Anthony was a Benchley only made her more cautious. She'd learned her lesson. # " Business? " he repeated. " You know, I'd heard that you	arrived	the other night with a dozen carriages full of your possessions. And -- Well, I'm not certain how to be delicate about this, but my solicitors keep telling me that Frederick signed Adam House over to you. I thought perhaps you might consider returning the house to the Benchley family. God knows I could use it to settle some of Frederick's remaining debts. "	other; hear	embedded listener	the other night		natural	COCA; 2011; New York : St. Martin's Paperbacks,Edition: St. Martin's Paperbacks ed; A beginner''s guide to rakes; Enoch, Suzanne; FIC: A beginner''s guide to rakes 
Anyway, Mr. Jones can tow the van to Herefordshire tomorrow when the shops open. How are you feeling? Shall we try to find a doctor today? " " No doctor, thanks. I just have a few aches and pains. Thank you for taking care of the van. You must have been up early. " " Depends on how you look at it. Up early or up late. I never went to bed. I hoped Hans might	arrive	with an explanation. I still wanted to believe my suspicions were a nasty nightmare. "	other; hope	accompaniment	with an explanation		natural	COCA;   2003 (Summer); . Vol. 79, Iss. 3; pg. 438; Searching for Arthur's stone; Deborah Prum; FIC: The Virginia Quarterly Review
It's overcast, " she murmured. # Meg nodded. " Look at the sea. I thought I felt us tossing about rather more vigorously than usual. " # The sea was near black without the stars to light it, but gray foam crested over every wave. On deck, the heightened pitch of the ship was more clearly defined. # " Do you think a storm is coming? " # " Perhaps. " Meg shuddered. " I do hope we	arrive	home before it strikes. " # " I'm certain we will. " Serena wasn't concerned. They'd survived several squalls and a rather treacherous storm in the past weeks. She had faith that Captain Moscum could pilot this ship through a hurricane, if need be.	other; hope	homebase	home		natural	COCA; 2011; New York : Forever,Edition: 1st ed; Confessions of an improper bride; Haymore, Jennifer; FIC: Confessions of an improper bride 
" I would give anything to swap places with you. " # " Sometimes wars are won by those who just stand sentinel, sir. " # " If so, I'd rather be doing the fighting, while someone else wins the war. " # Hartwell explained that he was not permitted within Ballard House due to some disagreement with Sir Charles, so he left me at the front door and led my horse on to the stables. Sir Charles was informed that I had	arrived	, and presently he came downstairs to the parlour. He had a rumpled, untidy look, was unshaven rather than bearded, and his hair was long and tousled. His expression was that of a man who had been interrupted while doing something important, and was feeling a bit cross about it.	other; inform	speaker	none		natural	COCA; 2012; Mar/Apr 2012; Electrica; McMullen, Sean; FIC: Fantasy & Science Fiction 
KOPPEL And we will be joined live by correspondent John Laurence from Sofia when we come back in just a moment. KOPPEL: Joining us now live from Sofia, Bulgaria is ABC News correspondent John Laurence. John, I know that you are only recently	arrived	there, and that is not a country in which you have specialized over the years, but nevertheless, give me a sense of why it is, when all of Europe seems to be moving away from Communism, why do you think the Bulgarians have decided to elect a Communist government? JOHN LAURENCE, ABC News: Well, Ted, it could be a combination of reasons.	other; know	listener	there		natural	COCA; 1990 (19900614); New Troubles in Romania and Bulgaria; SPOK: ABC_Nightline 
My dearest love, Please do not abandon me. The only solace that I can find is the hope that you will mourn for the return that I can not promise. Thinking of you, I am unable to sleep. The prayer call of the priests' silver trumpets has yet to mark the dawn, and I write by the light of an oil lamp, knowing this activity will not disturb my hosts. First, I wish you to know that I	arrived	safely for Passover, and I can report that Pascal and Seraphine are in good health. Now that my travel has ended, I have the luxury of applying markings to scroll. Far apart as we are, my intent is to begin each day of this week with you. I picture you listening to my letter and thus pretend we are in conversation. It aids me that I can imagine you reclining on your couch in our villa far above the harbor.	other; know	speaker	none		natural	COCA; 2004; Tyndale House Publishers; The weeping chamber; Brouwer, Sigmund, 1959; FIC: The weeping chamber 
